{
	"$schema": "https://emdashcms.com/seed.schema.json",
	"version": "1",
	"meta": {
		"name": "E2E Test Fixture",
		"description": "Schema for E2E tests"
	},
	"taxonomies": [
		{
			"name": "category",
			"label": "Categories",
			"labelSingular": "Category",
			"hierarchical": true,
			"collections": ["posts"],
			"terms": [
				{ "slug": "news", "label": "News" },
				{ "slug": "tutorials", "label": "Tutorials" },
				{ "slug": "opinion", "label": "Opinion" }
			]
		},
		{
			"name": "tag",
			"label": "Tags",
			"labelSingular": "Tag",
			"hierarchical": false,
			"collections": ["posts"]
		}
	],
	"sections": [
		{
			"slug": "hero",
			"title": "Hero Section",
			"description": "Main hero area",
			"content": [
				{
					"_type": "block",
					"_key": "b1",
					"style": "normal",
					"children": [{ "_type": "span", "_key": "s1", "text": "Welcome to our site" }],
					"markDefs": []
				}
			]
		}
	],
	"collections": [
		{
			"slug": "posts",
			"label": "Posts",
			"labelSingular": "Post",
			"supports": ["drafts", "revisions", "search"],
			"commentsEnabled": true,
			"fields": [
				{
					"slug": "title",
					"label": "Title",
					"type": "string",
					"required": true,
					"searchable": true
				},
				{
					"slug": "featured_image",
					"label": "Featured Image",
					"type": "image"
				},
				{
					"slug": "body",
					"label": "Body",
					"type": "portableText",
					"searchable": true
				},
				{
					"slug": "excerpt",
					"label": "Excerpt",
					"type": "text",
					"searchable": true
				},
				{
					"slug": "theme_color",
					"label": "Theme Color",
					"type": "string",
					"widget": "color:picker"
				},
				{
					"slug": "event",
					"label": "Event",
					"type": "json",
					"widget": "marketplace-test:event-picker"
				}
			]
		},
		{
			"slug": "pages",
			"label": "Pages",
			"labelSingular": "Page",
			"supports": ["drafts", "revisions", "search"],
			"fields": [
				{
					"slug": "title",
					"label": "Title",
					"type": "string",
					"required": true,
					"searchable": true
				},
				{
					"slug": "body",
					"label": "Body",
					"type": "portableText",
					"searchable": true
				}
			]
		}
	],
	"content": {
		"posts": [
			{
				"id": "first-post",
				"slug": "first-post",
				"status": "published",
				"data": { "title": "First Post", "excerpt": "The very first post" }
			},
			{
				"id": "second-post",
				"slug": "second-post",
				"status": "published",
				"data": { "title": "Second Post", "excerpt": "Another post" }
			},
			{
				"id": "draft-post",
				"slug": "draft-post",
				"status": "draft",
				"data": { "title": "Draft Post", "excerpt": "Not published yet" }
			}
		],
		"pages": [
			{
				"id": "about",
				"slug": "about",
				"status": "published",
				"data": { "title": "About" }
			},
			{
				"id": "contact",
				"slug": "contact",
				"status": "draft",
				"data": { "title": "Contact" }
			}
		]
	},
	"bylines": [
		{
			"id": "fixture-editorial",
			"slug": "fixture-editorial",
			"displayName": "Fixture Editorial"
		}
	]
}
